{"contract":"strategy-scope-list-page","schemaVersion":2,"requestId":"request-synthetic","asOf":"2026-10-14T08:00:00+00:00","data":{"items":[{"versionId":"version-synthetic","strategyId":"strategy-synthetic","versionNumber":1,"state":"draft","versionRevision":2,"provenance":"userRecorded","scopeRevision":1,"recordedPublicationSequence":2,"recordedAtUtc":"2026-10-14T08:00:00+00:00","scopeContentHash":"bbbbbbbbbbbbbbbbbbbbbbbbbbbbbbbbbbbbbbbbbbbbbbbbbbbbbbbbbbbbbbbb","instruments":{"classification":"selected","ids":["instrument-synthetic"]},"timeframes":{"classification":"unrestricted","ids":[]}}],"nextCursor":null,"publicationWatermark":2}}
